<?xml version="1.0" encoding="UTF-8"?>
<knapsack xmlns="http://www.diku.dk/robust/autogen/stochknapsack" xmlns:xsi="http://www.w3.org/2001/XMLSchema-instance" xsi:schemaLocation="http://www.diku.dk/robust/autogen/stochknapsack ../schema/knapsack/knapsack_instance.xsd ">
  <items>
    <item>
      <profit>2.0</profit>
      <stochasticWeight>
      	<normal mean="40" variance="10" />
      </stochasticWeight>
      
    </item>
    <item>
    	<profit>5</profit>
    	<stochasticWeight>
    		<normal mean="70" variance="20" />
    	</stochasticWeight>
    	
    </item>
    <item>
    	<profit>3.0</profit>
    	<stochasticWeight>
    		<normal mean="70" variance="20" ></normal>
    	</stochasticWeight>
    	
    </item>
    <item>
    	<profit>6.0</profit>
    	<stochasticWeight>
    		<normal mean="50" variance="10" />
    	</stochasticWeight>
    	
    </item>
    <item>
    	<profit>3.0</profit>
    	<stochasticWeight>
    		<normal mean="20" variance="2" />
    	</stochasticWeight>
    	
    </item>
    <item>
    	<profit>1.0</profit>
    	<stochasticWeight>
    		<normal mean="40" variance="6" />
    	</stochasticWeight>
    	
    </item>
    <item>
    	<profit>1.0</profit>
    	<stochasticWeight>
    		<normal mean="10" variance="2" />
    	</stochasticWeight>
    	
    </item>
    <item>
    	<profit>2.0</profit>
    	<stochasticWeight>
    		<normal mean="20" variance="1" />
    	</stochasticWeight>
    	
    </item>
    <item>
    	<profit>1.0</profit>
    	<stochasticWeight>
    		<normal mean="30" variance="3" />
    	</stochasticWeight>
    	
    </item>
    <item>
    	<profit>2.0</profit>
    	<stochasticWeight>
    		<normal mean="60" variance="10" />
    	</stochasticWeight>
    	
    </item>
    
  </items>
  <stochasticCapacity>
  	<normal mean="200" variance="40" />
  </stochasticCapacity>
  
</knapsack>
