<?xml version="1.0" encoding="UTF-8" standalone="yes"?>
<knapsack xmlns="http://www.diku.dk/robust/autogen/stochknapsack" xmlns:xsi="http://www.w3.org/2001/XMLSchema-instance" xsi:schemaLocation="http://www.diku.dk/robust/autogen/stochknapsack ../../schema/knapsack/knapsack_instance.xsd ">
    <items>
        <item>
            <profit>47.0</profit>
            <stochasticWeight>
                <normal variance="27.5625" mean="21.0"/>
            </stochasticWeight>
        </item>
        <item>
            <profit>66.0</profit>
            <stochasticWeight>
                <normal variance="33.0625" mean="23.0"/>
            </stochasticWeight>
        </item>
        <item>
            <profit>58.0</profit>
            <stochasticWeight>
                <normal variance="25.0" mean="20.0"/>
            </stochasticWeight>
        </item>
        <item>
            <profit>31.0</profit>
            <stochasticWeight>
                <normal variance="33.0625" mean="23.0"/>
            </stochasticWeight>
        </item>
        <item>
            <profit>66.0</profit>
            <stochasticWeight>
                <normal variance="42.25" mean="26.0"/>
            </stochasticWeight>
        </item>
        <item>
            <profit>60.0</profit>
            <stochasticWeight>
                <normal variance="33.0625" mean="23.0"/>
            </stochasticWeight>
        </item>
        <item>
            <profit>40.0</profit>
            <stochasticWeight>
                <normal variance="33.0625" mean="23.0"/>
            </stochasticWeight>
        </item>
        <item>
            <profit>36.0</profit>
            <stochasticWeight>
                <normal variance="30.25" mean="22.0"/>
            </stochasticWeight>
        </item>
        <item>
            <profit>53.0</profit>
            <stochasticWeight>
                <normal variance="45.5625" mean="27.0"/>
            </stochasticWeight>
        </item>
        <item>
            <profit>52.0</profit>
            <stochasticWeight>
                <normal variance="30.25" mean="22.0"/>
            </stochasticWeight>
        </item>
        <item>
            <profit>39.0</profit>
            <stochasticWeight>
                <normal variance="52.5625" mean="29.0"/>
            </stochasticWeight>
        </item>
        <item>
            <profit>51.0</profit>
            <stochasticWeight>
                <normal variance="30.25" mean="22.0"/>
            </stochasticWeight>
        </item>
        <item>
            <profit>61.0</profit>
            <stochasticWeight>
                <normal variance="33.0625" mean="23.0"/>
            </stochasticWeight>
        </item>
        <item>
            <profit>32.0</profit>
            <stochasticWeight>
                <normal variance="52.5625" mean="29.0"/>
            </stochasticWeight>
        </item>
        <item>
            <profit>67.0</profit>
            <stochasticWeight>
                <normal variance="42.25" mean="26.0"/>
            </stochasticWeight>
        </item>
        <item>
            <profit>39.0</profit>
            <stochasticWeight>
                <normal variance="52.5625" mean="29.0"/>
            </stochasticWeight>
        </item>
        <item>
            <profit>65.0</profit>
            <stochasticWeight>
                <normal variance="36.0" mean="24.0"/>
            </stochasticWeight>
        </item>
        <item>
            <profit>50.0</profit>
            <stochasticWeight>
                <normal variance="52.5625" mean="29.0"/>
            </stochasticWeight>
        </item>
        <item>
            <profit>32.0</profit>
            <stochasticWeight>
                <normal variance="52.5625" mean="29.0"/>
            </stochasticWeight>
        </item>
        <item>
            <profit>56.0</profit>
            <stochasticWeight>
                <normal variance="39.0625" mean="25.0"/>
            </stochasticWeight>
        </item>
        <item>
            <profit>68.0</profit>
            <stochasticWeight>
                <normal variance="33.0625" mean="23.0"/>
            </stochasticWeight>
        </item>
        <item>
            <profit>61.0</profit>
            <stochasticWeight>
                <normal variance="49.0" mean="28.0"/>
            </stochasticWeight>
        </item>
        <item>
            <profit>56.0</profit>
            <stochasticWeight>
                <normal variance="39.0625" mean="25.0"/>
            </stochasticWeight>
        </item>
        <item>
            <profit>60.0</profit>
            <stochasticWeight>
                <normal variance="27.5625" mean="21.0"/>
            </stochasticWeight>
        </item>
        <item>
            <profit>73.0</profit>
            <stochasticWeight>
                <normal variance="27.5625" mean="21.0"/>
            </stochasticWeight>
        </item>
        <item>
            <profit>34.0</profit>
            <stochasticWeight>
                <normal variance="27.5625" mean="21.0"/>
            </stochasticWeight>
        </item>
        <item>
            <profit>47.0</profit>
            <stochasticWeight>
                <normal variance="45.5625" mean="27.0"/>
            </stochasticWeight>
        </item>
        <item>
            <profit>35.0</profit>
            <stochasticWeight>
                <normal variance="30.25" mean="22.0"/>
            </stochasticWeight>
        </item>
        <item>
            <profit>52.0</profit>
            <stochasticWeight>
                <normal variance="36.0" mean="24.0"/>
            </stochasticWeight>
        </item>
        <item>
            <profit>24.0</profit>
            <stochasticWeight>
                <normal variance="30.25" mean="22.0"/>
            </stochasticWeight>
        </item>
        <item>
            <profit>69.0</profit>
            <stochasticWeight>
                <normal variance="30.25" mean="22.0"/>
            </stochasticWeight>
        </item>
        <item>
            <profit>66.0</profit>
            <stochasticWeight>
                <normal variance="42.25" mean="26.0"/>
            </stochasticWeight>
        </item>
        <item>
            <profit>23.0</profit>
            <stochasticWeight>
                <normal variance="45.5625" mean="27.0"/>
            </stochasticWeight>
        </item>
        <item>
            <profit>53.0</profit>
            <stochasticWeight>
                <normal variance="39.0625" mean="25.0"/>
            </stochasticWeight>
        </item>
        <item>
            <profit>52.0</profit>
            <stochasticWeight>
                <normal variance="27.5625" mean="21.0"/>
            </stochasticWeight>
        </item>
        <item>
            <profit>20.0</profit>
            <stochasticWeight>
                <normal variance="45.5625" mean="27.0"/>
            </stochasticWeight>
        </item>
        <item>
            <profit>29.0</profit>
            <stochasticWeight>
                <normal variance="42.25" mean="26.0"/>
            </stochasticWeight>
        </item>
        <item>
            <profit>30.0</profit>
            <stochasticWeight>
                <normal variance="33.0625" mean="23.0"/>
            </stochasticWeight>
        </item>
        <item>
            <profit>51.0</profit>
            <stochasticWeight>
                <normal variance="33.0625" mean="23.0"/>
            </stochasticWeight>
        </item>
        <item>
            <profit>21.0</profit>
            <stochasticWeight>
                <normal variance="36.0" mean="24.0"/>
            </stochasticWeight>
        </item>
        <item>
            <profit>39.0</profit>
            <stochasticWeight>
                <normal variance="36.0" mean="24.0"/>
            </stochasticWeight>
        </item>
        <item>
            <profit>44.0</profit>
            <stochasticWeight>
                <normal variance="30.25" mean="22.0"/>
            </stochasticWeight>
        </item>
        <item>
            <profit>57.0</profit>
            <stochasticWeight>
                <normal variance="25.0" mean="20.0"/>
            </stochasticWeight>
        </item>
        <item>
            <profit>23.0</profit>
            <stochasticWeight>
                <normal variance="42.25" mean="26.0"/>
            </stochasticWeight>
        </item>
        <item>
            <profit>62.0</profit>
            <stochasticWeight>
                <normal variance="52.5625" mean="29.0"/>
            </stochasticWeight>
        </item>
        <item>
            <profit>49.0</profit>
            <stochasticWeight>
                <normal variance="25.0" mean="20.0"/>
            </stochasticWeight>
        </item>
        <item>
            <profit>65.0</profit>
            <stochasticWeight>
                <normal variance="42.25" mean="26.0"/>
            </stochasticWeight>
        </item>
        <item>
            <profit>19.0</profit>
            <stochasticWeight>
                <normal variance="39.0625" mean="25.0"/>
            </stochasticWeight>
        </item>
        <item>
            <profit>46.0</profit>
            <stochasticWeight>
                <normal variance="42.25" mean="26.0"/>
            </stochasticWeight>
        </item>
        <item>
            <profit>36.0</profit>
            <stochasticWeight>
                <normal variance="39.0625" mean="25.0"/>
            </stochasticWeight>
        </item>
    </items>
    <stochasticCapacity>
        <normal variance="0.0" mean="1000.0"/>
    </stochasticCapacity>
</knapsack>
