<?xml version="1.0" encoding="UTF-8"?>
<knapsack xmlns="http://www.diku.dk/robust/autogen/stochknapsack" xmlns:xsi="http://www.w3.org/2001/XMLSchema-instance" xsi:schemaLocation="http://www.diku.dk/robust/autogen/stochknapsack ../../schema/knapsack/knapsack_instance.xsd ">
  <items>
    <item>
      <profit>2.0</profit>
      <stochasticWeight>
      	<normal mean="4.0" variance="1.0" />
      </stochasticWeight>
      
    </item>
    <item>
    	<profit>5.0</profit>
    	<stochasticWeight>
    		<normal mean="7.0" variance="2.0" />
    	</stochasticWeight>
    	
    </item>
    <item>
    	<profit>3.0</profit>
    	<stochasticWeight>
    		<normal mean="7.0" variance="2.0" ></normal>
    	</stochasticWeight>
    	
    </item>
    <item>
    	<profit>6.0</profit>
    	<stochasticWeight>
    		<normal mean="5.0" variance="1.0" />
    	</stochasticWeight>
    	
    </item>
    <item>
    	<profit>3.0</profit>
    	<stochasticWeight>
    		<normal mean="2.0" variance="0.2" />
    	</stochasticWeight>
    	
    </item>
    <item>
    	<profit>1.0</profit>
    	<stochasticWeight>
    		<normal mean="4.0" variance="0.6" />
    	</stochasticWeight>
    	
    </item>
    <item>
    	<profit>1.0</profit>
    	<stochasticWeight>
    		<normal mean="1.0" variance="0.2" />
    	</stochasticWeight>
    	
    </item>
    <item>
    	<profit>2.0</profit>
    	<stochasticWeight>
    		<normal mean="2.0" variance="0.1" />
    	</stochasticWeight>
    	
    </item>
    <item>
    	<profit>1.0</profit>
    	<stochasticWeight>
    		<normal mean="3.0" variance="0.3" />
    	</stochasticWeight>
    	
    </item>
    <item>
    	<profit>2.0</profit>
    	<stochasticWeight>
    		<normal mean="6.0" variance="1.0" />
    	</stochasticWeight>
    	
    </item>
    
  </items>
  <stochasticCapacity>
  	<normal mean="20.0" variance="4.0" />
  </stochasticCapacity>
  
  
  
  
  
  
</knapsack>
